page_id,recommendation,strategic_impact,complexity,urgency,resources,impact_score,quick_win_flag,owner,target_date,status
7f942435,"High Priority Issue: Restore and Populate the LinkedIn Page: Immediately fix the broken URL or redirect it to a live, fully functional LinkedIn company page for Sopra Steria Benelux. Ensure the page contains up-to-date corporate branding, messaging, and content tailored to the Benelux market.",General,Medium,Medium,TBD,9.8,True,,,Not Started
7f942435,"Medium Priority Issue: Develop Persona-Relevant Content: Once restored, enrich the page with clear corporate positioning and a compelling value proposition that addresses the strategic needs of C-suite executives in the Benelux region, emphasizing technology-driven growth and enterprise resilience.",General,Medium,Medium,TBD,9.8,True,,,Not Started
7f942435,"Low Priority Issue: Add Trust Signals and Clear CTAs: Incorporate trust elements such as client logos, case studies, certifications, and leadership bios. Provide clear calls to action like “Contact Us,” “Explore Solutions,” or “Join Our Events” to guide executives toward engagement.",Conversion Optimization,Low,Medium,TBD,9.8,True,,,Not Started
4fb3c324,"High Priority Issue: Enhance Value Proposition and Persona Relevance: Clearly articulate how Sopra Steria’s innovation and technology solutions directly address the strategic challenges of Benelux C-suite executives, such as managing growth, resilience, and operational excellence amid market volatility. Use language and examples that reflect their priorities and pain points.",Value Proposition,Medium,Medium,TBD,5.2,False,,,Not Started
4fb3c324,"Medium Priority Issue: Introduce Strong Differentiators and Proof Points: Incorporate unique selling points, proprietary methodologies, or success stories that distinguish Sopra Steria from competitors. Add client testimonials, case studies, or industry recognitions to build credibility and trust.",Trust & Credibility,Low,Medium,TBD,5.2,False,,,Not Started
4fb3c324,"Low Priority Issue: Add Clear, Strategic Calls-to-Action: Provide CTAs that invite the persona to engage further, such as scheduling a consultation, accessing in-depth reports tailored to the Benelux market, or joining executive webinars. This will help convert interest into meaningful business conversations.",General,Medium,Medium,TBD,5.2,False,,,Not Started
51dceb19,"High Priority Issue: Enhance Value Proposition Clarity and Persona Relevance: Develop and prominently feature a clear, concise value proposition statement that explicitly addresses how Sopra Steria helps Benelux C-suite leaders achieve growth, resilience, and operational excellence amid market volatility. Use language that resonates with their strategic priorities and challenges.",Value Proposition,Medium,Medium,TBD,3.8,False,,,Not Started
51dceb19,"Medium Priority Issue: Strengthen Brand Differentiation: Incorporate messaging that highlights Sopra Steria’s unique competitive advantages versus other European IT services firms, such as specialized expertise in Benelux markets, proprietary methodologies, or innovative service models that support long-term enterprise viability.",Brand Differentiation,High,Medium,TBD,3.8,False,,,Not Started
51dceb19,"Low Priority Issue: Improve Call-to-Action Effectiveness: Add clear, relevant CTAs tailored to the persona, such as “Connect with our Benelux leadership team,” “Explore our strategic solutions for Benelux enterprises,” or “Download our latest insights on digital resilience in Benelux.” This will facilitate engagement and conversion from high-level visitors.",Conversion Optimization,Low,Medium,TBD,3.8,False,,,Not Started
51dceb19,"Additional Suggestion: Localize Content for Benelux: Consider adding localized content or case studies demonstrating Sopra Steria’s impact in Benelux organizations, reinforcing relevance and trust for this regional executive audience.",General,Medium,Medium,TBD,3.8,False,,,Not Started
