page_id,criterion_code,criterion_name,score,evidence,weight_pct,tier,descriptor,impact_score
cded0b85,value_proposition_clarity,Value Proposition Clarity,7.0,"The page communicates a clear value proposition around accelerating cloud adoption, modernization, and securing Azure environments with AI and zero-trust principles. However, it is broad and somewhat technical, lacking explicit linkage to the persona’s key priorities such as regulatory compliance (e.g., DORA, NIS2, GDPR) or specific risk management outcomes. The benefits are implied but could be more directly articulated for a CISO/CIO audience.",20,Service Offering / Solution Detail Page  ,WARN,3.0
cded0b85,trust_credibility_signals,Trust & Credibility Signals,7.0,"The page includes credible proof points such as Microsoft certifications, strategic partnership duration, and number of skilled professionals. The “Microsoft Azure Expert Managed Services Provider (MSP)” status and “12 Microsoft Specializations” are strong trust signals. However, there is a lack of explicit client logos, case studies, or testimonials specifically focused on cybersecurity and compliance in the public sector, which would better resonate with this persona.",10,Service Offering / Solution Detail Page  ,WARN,1.5
cded0b85,calltoaction_effectiveness,Call-to-Action Effectiveness,6.0,"The page ends with a “Contact us today” invitation and a form for inquiries, which is relevant but generic. The CTAs could be more tailored to the persona’s needs, such as offering downloadable compliance-focused whitepapers, invitations to webinars on regulatory challenges, or direct links to security assessments or Azure security workshops. The current CTA is functional but lacks urgency or personalization.",10,Service Offering / Solution Detail Page  ,WARN,2.0
624753c4,corporate_positioning_alignment,Corporate Positioning Alignment,8.0,"**Evidence:** The page opens with ""Financial Services: change-driven, results-focused"" and emphasizes Sopra Steria’s role in supporting banks ""along the entire value chain, from strategy to operations,"" highlighting digital transformation and regulatory compliance. The mention of ""trustworthy, secure, and compliant environment"" aligns well with the company’s core brand messaging.",25,Industry Solutions Landing Page (Financial Services Sector)  ,PASS,2.5
624753c4,brand_differentiation,Brand Differentiation,6.0,"**Evidence:** The page references deep industry knowledge, comprehensive support, and innovation but lacks explicit comparison or unique differentiators versus competitors. Phrases like ""transforming the industry"" and ""drive smooth and future-proof operations"" are generic and could apply to many consulting firms.",20,Industry Solutions Landing Page (Financial Services Sector)  ,WARN,4.0
624753c4,value_proposition_clarity,Value Proposition Clarity,7.0,"**Evidence:** The page highlights key benefits: risk management, regulatory compliance, data protection, and innovation. The whitepaper on ""Turn the tide on financial crime"" and references to helping banks succeed in the ""new digital normal"" provide some clarity on value.",20,Industry Solutions Landing Page (Financial Services Sector)  ,WARN,3.0
624753c4,trust_credibility_signals,Trust & Credibility Signals,6.0,"**Evidence:** The page mentions ""Sopra Steria, a major Tech player in Europe with 50,000 employees in nearly 30 countries,"" and lists client stories and whitepapers. However, there are no visible certifications, awards, client logos, or explicit references to compliance standards (e.g., ISO 27001, GDPR adherence) on this page.",10,Industry Solutions Landing Page (Financial Services Sector)  ,WARN,2.0
624753c4,calltoaction_effectiveness,Call-to-Action Effectiveness,7.0,"**Evidence:** The page includes multiple ""LET'S TALK"" CTAs and links to whitepapers and sector-specific pages (""LEARN MORE""). There is also a contact form with relevant fields for inquiries. However, the CTAs are generic and do not specifically address cybersecurity decision makers or regulatory compliance concerns.",10,Industry Solutions Landing Page (Financial Services Sector)  ,WARN,1.5
2aa6d30b,corporate_positioning_alignment,Corporate Positioning Alignment,7.0,"The page strongly communicates Sopra Steria’s commitment to sustainability, ethics, and social responsibility, consistent with its corporate mission of leveraging digital technology for a positive future. The CEO’s message and the emphasis on sustainability, social inclusion, and ethics align well with a responsible corporate image. However, the messaging is broad and focused on societal and environmental responsibility rather than explicitly tying these commitments to cybersecurity or risk management.",25,Corporate Responsibility / ESG Branding Page  ,WARN,3.75
2aa6d30b,brand_differentiation,Brand Differentiation,4.0,"The content is generic in the CSR space, emphasizing common themes like sustainability, diversity, and ethics without clearly differentiating Sopra Steria from competitors. There is no mention of unique cybersecurity capabilities, compliance expertise, or innovation in security solutions that would resonate with a cybersecurity decision maker. The page reads like a standard corporate responsibility statement rather than a distinctive brand proposition in cybersecurity or risk management.",20,Corporate Responsibility / ESG Branding Page  ,CONCERN,6.0
2aa6d30b,value_proposition_clarity,Value Proposition Clarity,4.0,"The value proposition is implicit and focused on broad corporate responsibility goals rather than specific benefits for cybersecurity executives. There is no clear articulation of how Sopra Steria’s corporate responsibility efforts translate into enhanced security, compliance, or risk mitigation for clients, particularly in regulated sectors like the public sector under DORA, NIS2, or GDPR. The messaging lacks a compelling callout of how these commitments create competitive advantage or innovation in cybersecurity.",20,Corporate Responsibility / ESG Branding Page  ,CONCERN,6.0
2aa6d30b,trust_credibility_signals,Trust & Credibility Signals,6.0,"The page includes credible elements such as the CEO’s message, an advisory board with external experts, and references to long-term commitments and recognized environmental programs. However, it lacks concrete, verifiable proof points relevant to cybersecurity or regulatory compliance (e.g., certifications, case studies, client testimonials, compliance frameworks). The absence of specific metrics or examples tied to security or risk management weakens trust from the persona’s perspective.",10,Corporate Responsibility / ESG Branding Page  ,WARN,2.0
2aa6d30b,calltoaction_effectiveness,Call-to-Action Effectiveness,2.0,"There is no clear or relevant call-to-action (CTA) for a cybersecurity decision maker. The page invites visitors to “Discover more” about environmental, social, and ethics commitments but does not guide the persona toward engaging with Sopra Steria’s cybersecurity services, compliance expertise, or risk management solutions. The embedded video is blocked by consent management, further reducing engagement opportunities. The lack of tailored CTAs for this persona is a critical gap.",10,Corporate Responsibility / ESG Branding Page  ,FAIL,4.0
