page_id,criterion_code,criterion_name,score,evidence,weight_pct,tier,descriptor,impact_score
ce6ef35e,corporate_positioning_alignment,Corporate Positioning Alignment,7.0,"The page aligns with Sopra Steria’s brand as a trusted digital business partner leveraging AI and data science to drive transformation. Phrases like “As your trusted digital business partner” and highlighting “extensive team of data scientists” reflect corporate positioning well. However, the focus is more on AI broadly rather than tightly integrating cybersecurity or compliance, which is critical for the persona.",25,Thought Leadership / Insights Page  ,WARN,3.75
ce6ef35e,brand_differentiation,Brand Differentiation,6.0,"The content emphasizes responsible and industrialized AI deployment and multidisciplinary teams, which are positive differentiators. Yet, it lacks explicit comparison or unique positioning against competitors, especially in the cybersecurity or regulatory compliance domain. The AI focus is generic and does not strongly differentiate Sopra Steria’s unique strengths for security-driven organizations.",20,Thought Leadership / Insights Page  ,WARN,4.0
ce6ef35e,value_proposition_clarity,Value Proposition Clarity,6.0,"The value proposition centers on “extracting actionable insights” and “responsible AI-powered solutions” with ROI focus. This is relevant but somewhat generic. For the persona, explicit linkage to cybersecurity resilience, regulatory compliance (e.g., DORA, NIS2, GDPR), and risk management is missing or very implicit. Clearer articulation of how AI solutions mitigate risks or ensure compliance would improve clarity.",20,Thought Leadership / Insights Page  ,WARN,4.0
ce6ef35e,trust_credibility_signals,Trust & Credibility Signals,6.0,"The page references “Sopra Steria, a major Tech player in Europe with 50,000 employees in nearly 30 countries,” which adds credibility. However, there are no direct case studies, certifications, compliance frameworks, or client logos specifically related to cybersecurity or public sector compliance. The presence of whitepapers and blogs is good but not strongly highlighted as trust proof points for this persona.",10,Thought Leadership / Insights Page  ,WARN,2.0
ce6ef35e,calltoaction_effectiveness,Call-to-Action Effectiveness,7.0,"The “LET'S TALK” contact form is prominently placed with relevant fields, including country and inquiry subject, facilitating lead capture. However, CTAs are generic and do not specifically invite the persona to engage on cybersecurity or compliance topics. There are no tailored CTAs for downloading reports, requesting demos, or consulting on regulatory compliance and cyber resilience.",10,Thought Leadership / Insights Page  ,WARN,1.5
b53c7bea,corporate_positioning_alignment,Corporate Positioning Alignment,7.0,"**Evidence:** The page opens with ""Powering progress for people, networks and industries"" and highlights Sopra Steria’s role in enabling robust infrastructure and digital transformation. It references collaboration with national and international players and emphasizes professional excellence and innovation. The content aligns well with Sopra Steria’s positioning as a major European tech and consulting player with broad digital expertise. <br> **Rationale:** The messaging is consistent with a trusted, innovative technology and consulting brand, which is relevant to the persona’s need for a reliable partner. However, the positioning is broad and somewhat generic, lacking a sharp focus on cybersecurity or regulatory compliance, which are critical for this persona. <br> **Improvement Recommendation:** Integrate stronger, explicit references to cybersecurity leadership and regulatory compliance as core brand pillars to better align with the persona’s priorities and reinforce corporate positioning in security and risk management.",25,Industry Solutions Landing Page (Sector-specific overview page targeting multiple industries)  ,WARN,3.75
b53c7bea,brand_differentiation,Brand Differentiation,5.0,"**Evidence:** The page mentions advanced technologies like AI, autonomous transport, rapid application development, and integrated supply chain expertise. However, these capabilities are presented in a generic manner without clear differentiation from competitors. There is no unique value claim or proprietary approach highlighted that sets Sopra Steria apart in cybersecurity or compliance for the Benelux public sector. <br> **Rationale:** For a cybersecurity decision maker, differentiation is critical, especially regarding compliance expertise and innovative security solutions. The page’s broad industry focus dilutes differentiation and does not emphasize what makes Sopra Steria uniquely qualified versus other consultancies or tech providers. <br> **Improvement Recommendation:** Highlight unique methodologies, certifications, or success metrics in cybersecurity and compliance, especially related to Benelux regulations (e.g., DORA, NIS2, GDPR). Use case studies or client logos to showcase proven differentiation.",20,Industry Solutions Landing Page (Sector-specific overview page targeting multiple industries)  ,CONCERN,5.0
b53c7bea,value_proposition_clarity,Value Proposition Clarity,6.0,"**Evidence:** The page describes benefits such as ""streamlining processes,"" ""driving innovation,"" ""building resilience and visibility,"" and ""ensuring your supply chain is secure and compliant with all relevant regulations."" These statements imply value but are high-level and somewhat vague. There is no concise, compelling value proposition tailored specifically to cybersecurity decision makers in the Benelux public sector. <br> **Rationale:** The persona requires clear articulation of how Sopra Steria’s solutions reduce risk, ensure compliance, and enhance cyber resilience in a complex regulatory environment. The current value proposition is competent but generic and lacks direct appeal to the persona’s critical pain points. <br> **Improvement Recommendation:** Craft a clear, persona-focused value proposition emphasizing regulatory compliance expertise, risk mitigation, and cyber resilience outcomes, supported by concrete examples or KPIs.",20,Industry Solutions Landing Page (Sector-specific overview page targeting multiple industries)  ,WARN,4.0
b53c7bea,trust_credibility_signals,Trust & Credibility Signals,5.0,"**Evidence:** The page references collaboration with ""key national and international players,"" mentions ""extensive practical experience,"" and includes a few client success stories (e.g., POST Luxembourg, Telefónica). However, these references are not prominently displayed or detailed. There are no certifications, awards, or compliance accreditations explicitly mentioned. The page lacks visible testimonials or security-specific proof points. <br> **Rationale:** Trust is paramount for cybersecurity executives. The absence of strong, explicit trust signals such as compliance certifications, security accreditations, or detailed client endorsements weakens credibility from this persona’s perspective. <br> **Improvement Recommendation:** Add visible trust signals such as ISO 27001 certification, compliance with Benelux-specific regulations, client testimonials, and case studies focused on cybersecurity and regulatory success.",10,Industry Solutions Landing Page (Sector-specific overview page targeting multiple industries)  ,CONCERN,2.5
b53c7bea,calltoaction_effectiveness,Call-to-Action Effectiveness,7.0,"**Evidence:** The page includes multiple ""Let's talk"" CTAs and a contact form with fields relevant to business inquiries. There are also ""Learn More"" links for specific sectors. However, the CTAs are generic and do not explicitly invite cybersecurity or compliance discussions. There is no tailored CTA for the persona to request security assessments, compliance audits, or executive briefings. <br> **Rationale:** While CTAs are present and functional, they lack persona-specific relevance and urgency. For a senior cybersecurity decision maker, CTAs should clearly guide towards next steps that address their specific needs (e.g., compliance workshops, risk assessments). <br> **Improvement Recommendation:** Introduce targeted CTAs such as ""Request a Cybersecurity Compliance Assessment,"" ""Download our Benelux Cybersecurity Whitepaper,"" or ""Schedule a Risk Management Consultation"" to increase engagement from this persona.",10,Industry Solutions Landing Page (Sector-specific overview page targeting multiple industries)  ,WARN,1.5
4b79a42a,corporate_positioning_alignment,Corporate Positioning Alignment,2.0,"**Evidence:** The page is a YouTube channel landing page behind a cookie consent gate with no visible brand messaging, positioning statements, or corporate narrative. The content is limited to cookie consent text and language selection options. There is no mention of Sopra Steria’s core brand message, cybersecurity focus, or regional relevance to Benelux or public sector. <br> **Rationale:** For a CISO-level persona seeking clear alignment with corporate cybersecurity leadership, this page provides zero contextual positioning or brand messaging.",25,YouTube Brand Channel Landing Page (Cookie Consent Gate)  ,FAIL,10.0
4b79a42a,brand_differentiation,Brand Differentiation,1.0,"**Evidence:** The page contains no content beyond cookie consent and language options. There is no differentiation from competitors or any unique value proposition visible. <br> **Rationale:** Without any brand or content visible, the page fails entirely to demonstrate how Sopra Steria stands apart from other cybersecurity or consulting firms. It is indistinguishable from any generic YouTube channel landing page.",20,YouTube Brand Channel Landing Page (Cookie Consent Gate)  ,FAIL,9.0
4b79a42a,value_proposition_clarity,Value Proposition Clarity,1.0,"**Evidence:** No value proposition is presented. The page does not communicate any benefits, solutions, or outcomes relevant to cybersecurity decision makers or compliance needs. <br> **Rationale:** The persona requires clear, compelling reasons to engage with the brand, especially around compliance, risk, and innovation. This page offers none.",20,YouTube Brand Channel Landing Page (Cookie Consent Gate)  ,FAIL,9.0
4b79a42a,trust_credibility_signals,Trust & Credibility Signals,3.0,"**Evidence:** The only trust-related element is the cookie consent notice referencing Google’s data privacy practices, which is standard and unrelated to Sopra Steria’s brand credibility. No logos, certifications, testimonials, case studies, or regulatory compliance references are present. <br> **Rationale:** While the cookie consent shows compliance with privacy regulations (a minor positive), it does not build trust in Sopra Steria’s cybersecurity expertise or reliability.",10,YouTube Brand Channel Landing Page (Cookie Consent Gate)  ,FAIL,3.5
4b79a42a,calltoaction_effectiveness,Call-to-Action Effectiveness,3.0,"**Evidence:** The only actions available are to accept or reject cookies or adjust privacy settings. There is no brand-related call to action such as “Learn more about our cybersecurity solutions,” “Contact us,” or “Watch our latest compliance webinar.” <br> **Rationale:** The persona expects clear next steps aligned with their role and priorities. This page’s CTAs are generic and unrelated to business engagement or information discovery.",10,YouTube Brand Channel Landing Page (Cookie Consent Gate)  ,FAIL,3.5
d83b69a8,corporate_positioning_alignment,Corporate Positioning Alignment,7.0,"**Evidence:** The page clearly positions Sopra Steria Next as a forward-thinking consultancy division of a major European technology group, emphasizing strategic AI market insights and innovation. Quotes like “transforming AI from a technological concern into a genuine lever of business performance” and “providing decision-makers with a clear strategic reading” align well with a corporate positioning focused on innovation and strategic advisory. <br> **Rationale:** This aligns with the persona’s need for strategic insights and innovation leadership, but the focus is heavily on AI market growth rather than cybersecurity or compliance, which are core to this persona. <br> **Improvement:** Integrate explicit references to how Sopra Steria’s AI expertise supports cybersecurity, risk management, and regulatory compliance to better align with the persona’s core concerns.",25,Press Release / Thought Leadership Insight  ,WARN,3.75
d83b69a8,brand_differentiation,Brand Differentiation,6.0,"**Evidence:** The page introduces a unique methodology segmenting AI into four archetypes and provides detailed market forecasts. This approach offers some differentiation from generic AI market reports. However, the content is largely focused on AI market sizing and growth, which many competitors also cover. There is limited explicit differentiation in terms of cybersecurity leadership or compliance expertise. <br> **Rationale:** While the archetype methodology is a differentiator, it lacks direct linkage to cybersecurity or regulatory compliance, which are critical for this persona. <br> **Improvement:** Highlight Sopra Steria’s unique cybersecurity AI solutions or compliance-driven AI use cases to strengthen differentiation for this persona.",20,Press Release / Thought Leadership Insight  ,WARN,4.0
d83b69a8,value_proposition_clarity,Value Proposition Clarity,6.0,"**Evidence:** The value proposition centers on providing a “strategic compass” for AI investments and enabling “optimised investments” aligned with business priorities. The study promises a “360-degree view” and sector-specific AI use cases. However, the messaging is abstract and focused on AI market potential rather than concrete benefits or solutions for cybersecurity decision-makers. <br> **Rationale:** The value proposition is somewhat generic and does not clearly articulate how Sopra Steria’s AI expertise directly mitigates cyber risk, ensures compliance, or enhances resilience — key priorities for the persona. <br> **Improvement:** Clarify the value proposition by explicitly linking AI capabilities to cybersecurity risk reduction, compliance facilitation (e.g., GDPR, NIS2, DORA), and operational resilience.",20,Press Release / Thought Leadership Insight  ,WARN,4.0
d83b69a8,trust_credibility_signals,Trust & Credibility Signals,7.0,"**Evidence:** The page includes credible data points (e.g., market size forecasts, growth rates), quotes from the CEO Fabrice Asvazadourian, and references to Sopra Steria’s 40,000 IT professionals. It also mentions sector-specific insights and use cases, which add credibility. However, there are no third-party validations, certifications, or client testimonials related to cybersecurity or compliance. <br> **Rationale:** The presence of leadership quotes and detailed data supports credibility, but the lack of explicit cybersecurity or compliance trust signals limits resonance with the persona. <br> **Improvement:** Add cybersecurity certifications, compliance accreditations, client success stories, or analyst endorsements relevant to the Benelux public sector cybersecurity environment.",10,Press Release / Thought Leadership Insight  ,WARN,1.5
d83b69a8,calltoaction_effectiveness,Call-to-Action Effectiveness,4.0,"**Evidence:** The page ends abruptly without a clear call-to-action (CTA). There is no direct invitation to download the full study, contact Sopra Steria for a consultation, or explore cybersecurity-specific services. The navigation menu is extensive but generic, not guiding the persona towards relevant next steps. <br> **Rationale:** For a senior decision-maker seeking actionable insights or engagement, the absence of a clear, relevant CTA is a critical gap. <br> **Improvement:** Include a prominent CTA such as “Download the full AI market study,” “Contact our cybersecurity experts,” or “Explore AI-driven compliance solutions” tailored to the persona’s interests.",10,Press Release / Thought Leadership Insight  ,CONCERN,3.0
ad80a76c,corporate_positioning_alignment,Corporate Positioning Alignment,8.0,"The page clearly positions Sopra Steria as a major European tech player with a strong presence in the Benelux region (""+4,000 Employees in the Benelux"", ""51,000 Employees in 30 countries""). The tagline ""The world is how we shape it"" conveys a forward-thinking, shaping-the-future mindset aligned with innovation and transformation. The inclusion of services like Cybersecurity, AI, and Compliance aligns well with the persona’s strategic priorities.",25,Corporate Homepage / Corporate Brand & Services Overview  ,PASS,2.5
ad80a76c,brand_differentiation,Brand Differentiation,6.0,"While the page lists a broad range of industries and services, including Cybersecurity and compliance-related offerings (e.g., NIS2, DORA), the differentiation from competitors is somewhat generic. The messaging emphasizes breadth and scale but lacks unique, compelling differentiators or proprietary approaches tailored specifically to the Benelux public sector cybersecurity decision maker.",20,Corporate Homepage / Corporate Brand & Services Overview  ,WARN,4.0
ad80a76c,value_proposition_clarity,Value Proposition Clarity,7.0,"The value proposition is present but somewhat implicit. Statements like ""Create trust in a hyper-connected world"" and references to compliance (e.g., ""Strengthen your organisation and stay secure with NIS"") address key persona concerns. However, the messaging could be more direct and focused on how Sopra Steria uniquely enables regulatory compliance, risk management, and cyber resilience specifically for Benelux public sector organizations.",20,Corporate Homepage / Corporate Brand & Services Overview  ,WARN,3.0
ad80a76c,trust_credibility_signals,Trust & Credibility Signals,8.0,"The site includes multiple trust indicators: client stories (e.g., Curium, CZ Zorgverzekeringen), certifications (Mendix Delivery Excellence), and references to compliance frameworks (DORA, NIS2). The presence of whitepapers, publications, and news updates demonstrates thought leadership. However, more explicit references to Benelux-specific regulatory expertise or endorsements would strengthen credibility further.",10,Corporate Homepage / Corporate Brand & Services Overview  ,PASS,1.0
ad80a76c,calltoaction_effectiveness,Call-to-Action Effectiveness,6.0,"Calls to action are somewhat diffuse and generic—primarily ""Discover"" links for services and insights, and navigation to careers or contact pages. There is no strong, singular CTA tailored to the persona, such as ""Request a Compliance Assessment,"" ""Schedule a Cybersecurity Consultation,"" or ""Download Benelux Cybersecurity Whitepaper."" This reduces immediacy and relevance for a senior decision maker seeking actionable next steps.",10,Corporate Homepage / Corporate Brand & Services Overview  ,WARN,2.0
f52cdbdc,corporate_positioning_alignment,Corporate Positioning Alignment,6.0,"**Evidence:** The article discusses advanced AI concepts such as few-shot prompting, context windows, system prompts, function calling, and Retrieval-Augmented Generation (RAG). The Sopra Steria brand is positioned as knowledgeable in AI and digital transformation, which aligns with their broader corporate messaging on innovation and digital consulting. <br>**Rationale:** The content reflects the company’s expertise in AI and digital innovation but lacks explicit linkage to Sopra Steria’s core cybersecurity and compliance brand pillars, which are critical for this persona. The article feels more generic AI-focused rather than tightly integrated with Sopra Steria’s cybersecurity leadership or regulatory compliance positioning. <br>**Improvement Recommendation:** Integrate explicit references to Sopra Steria’s cybersecurity and compliance expertise, especially in relation to AI’s role in secure, compliant digital transformation within regulated industries like public sector. Add branding elements or framing that connect AI innovation to risk management and regulatory compliance.",25,Thought Leadership Blog Article  ,WARN,5.0
f52cdbdc,brand_differentiation,Brand Differentiation,4.0,"**Evidence:** The blog provides general best practices for interacting with LLMs but does not highlight any unique Sopra Steria methodologies, proprietary tools, or case studies that differentiate them from competitors. The content is educational but generic and could be found on many AI consultancy or tech vendor sites. <br>**Rationale:** For a CISO or security executive in the Benelux public sector, differentiation is key. The article misses an opportunity to showcase Sopra Steria’s unique approach to AI-driven cybersecurity or compliance solutions, or how they uniquely integrate AI with regulatory frameworks like DORA or NIS2. <br>**Improvement Recommendation:** Include examples or case studies demonstrating Sopra Steria’s unique AI capabilities in cybersecurity or compliance. Highlight proprietary frameworks, partnerships, or success stories that set Sopra Steria apart in the AI-cybersecurity space.",20,Thought Leadership Blog Article  ,CONCERN,6.0
f52cdbdc,value_proposition_clarity,Value Proposition Clarity,5.0,"**Evidence:** The article offers useful tips on maximizing value from LLMs but does not clearly articulate a compelling value proposition tailored to the persona’s priorities such as regulatory compliance, risk management, or enterprise cyber resilience. The conclusion encourages better AI usage but stops short of linking this to business outcomes or Sopra Steria’s services. <br>**Rationale:** The Benelux Cybersecurity Decision Maker needs clear, compelling reasons why Sopra Steria’s AI expertise will help them meet compliance and security goals. The value proposition here is implicit and generic rather than explicit and persona-focused. <br>**Improvement Recommendation:** Clearly state how Sopra Steria’s AI and cybersecurity expertise helps organizations meet evolving regulatory requirements and manage cyber risks effectively. Use language that ties AI capabilities directly to business resilience and compliance imperatives.",20,Thought Leadership Blog Article  ,CONCERN,5.0
f52cdbdc,trust_credibility_signals,Trust & Credibility Signals,5.0,"**Evidence:** The page is hosted on Sopra Steria’s official domain and includes standard corporate navigation and branding. However, the blog itself lacks explicit trust signals such as client logos, certifications, awards, expert author credentials, or references to compliance standards. There are no direct quotes from customers or third-party validations. <br>**Rationale:** Trust is paramount for this persona. While the corporate domain lends some credibility, the absence of explicit trust signals or proof points reduces confidence in the content’s authority and the company’s expertise in cybersecurity and compliance. <br>**Improvement Recommendation:** Add author bios with credentials, client testimonials or case studies, relevant certifications (e.g., ISO 27001), and references to compliance frameworks. Incorporate trust badges or links to regulatory compliance expertise to reinforce credibility.",10,Thought Leadership Blog Article  ,CONCERN,2.5
f52cdbdc,calltoaction_effectiveness,Call-to-Action Effectiveness,3.0,"**Evidence:** The blog ends with a conclusion summarizing the five strategies but does not include a clear, actionable next step for the reader. There are no calls to action (CTAs) such as contacting Sopra Steria for a consultation, downloading related whitepapers, or exploring cybersecurity services. The navigation includes links to other content but nothing targeted or personalized for this persona. <br>**Rationale:** For an executive persona, clear CTAs aligned with their needs (e.g., compliance assessments, cybersecurity strategy workshops) are critical to drive engagement. The lack of relevant CTAs means the page misses conversion opportunities. <br>**Improvement Recommendation:** Add strong, persona-relevant CTAs such as “Contact our cybersecurity experts to learn how AI can enhance your compliance strategy,” or “Download our whitepaper on AI and regulatory compliance in the public sector.” Ensure CTAs are visible and action-oriented.",10,Thought Leadership Blog Article  ,FAIL,3.5
cded0b85,corporate_positioning_alignment,Corporate Positioning Alignment,8.0,"The page strongly reflects Sopra Steria’s core brand message as a trusted, experienced digital transformation and cloud services provider with a strong Microsoft partnership. Phrases like “18-year strategic partnership with Microsoft” and “5,500 Microsoft-skilled professionals” reinforce corporate identity and expertise. The emphasis on AI-driven tools and cloud modernization aligns with Sopra Steria’s innovation and technology leadership positioning.",25,Service Offering / Solution Detail Page  ,PASS,2.5
cded0b85,brand_differentiation,Brand Differentiation,6.0,"While the page highlights Sopra Steria’s Microsoft partnership and certifications, the content is somewhat generic in describing cloud transformation services. The mention of AI tools like GitHub Copilot and the Azure well-architected framework review adds some differentiation, but many competitors offer similar Azure services. There is limited explicit comparison or unique value claims that clearly separate Sopra Steria from peers in the Benelux cybersecurity and public sector context.",20,Service Offering / Solution Detail Page  ,WARN,4.0
