page_id,criterion_code,criterion_name,score,evidence,weight_pct,tier,descriptor,impact_score
fe8eb8c2,corporate_positioning_alignment,Corporate Positioning Alignment,7.0,"**Evidence:** The blog emphasizes collaboration, trust, and cybersecurity within ecosystems, aligning with Sopra Steria’s positioning as a digital transformation and cybersecurity consulting firm. Quotes such as “When you get data security and privacy right and conduct good risk management, you can be sure that things will never really get out of hand” (Eelco Stofbergen, business director cybersecurity) reinforce the company’s focus on security and risk management. The mention of public sector programs (Dutch Digital Infrastructure Logistics) also aligns with their industry focus. <br> **Rationale:** The page reflects Sopra Steria’s core brand message of enabling secure, innovative digital ecosystems, which resonates with the persona’s need for secure, compliant, and resilient digital environments. However, the messaging is somewhat generic and lacks explicit linkage to Sopra Steria’s unique capabilities or proprietary approaches. <br> **Improvement:** Include clearer references to Sopra Steria’s unique methodologies, certifications, or case studies to strengthen brand positioning.",25,Thought Leadership Blog / Insights Page  ,WARN,3.75
fe8eb8c2,brand_differentiation,Brand Differentiation,5.0,"**Evidence:** The blog discusses ecosystem collaboration and trust challenges, referencing common industry themes like data sharing, risk, and regulatory compliance. The inclusion of a client example (large airport operator) adds some differentiation but is not deeply tied to unique Sopra Steria solutions. The content references Gartner and McKinsey research but does not clearly articulate how Sopra Steria’s approach differs from competitors. <br> **Rationale:** For a CISO or similar executive, differentiation is critical to justify vendor selection. The content is competent but reads as a general industry overview rather than a distinctive Sopra Steria perspective. <br> **Improvement:** Highlight unique tools, frameworks, or success metrics that differentiate Sopra Steria’s ecosystem and cybersecurity services. Use more proprietary data or client success stories with measurable outcomes.",20,Thought Leadership Blog / Insights Page  ,CONCERN,5.0
fe8eb8c2,value_proposition_clarity,Value Proposition Clarity,7.0,"**Evidence:** The blog clearly states benefits of ecosystem collaboration: improved efficiency, risk mitigation, innovation, and competitive advantage. It also stresses the importance of trust, cybersecurity, and regulatory compliance, which are key priorities for the persona. The quote “If everyone understands that the partnership is a win-win, they’ll be more likely to collaborate and share data” directly addresses value realization. <br> **Rationale:** The value proposition aligns well with the persona’s priorities but is somewhat implicit rather than explicitly framed as Sopra Steria’s offering. The blog educates but does not strongly push a compelling, differentiated value proposition or call out specific solutions or outcomes. <br> **Improvement:** Make the value proposition more explicit and tailored, e.g., “Sopra Steria helps Benelux public sector CISOs build trusted, compliant ecosystems with our proven cybersecurity frameworks and regulatory expertise.”",20,Thought Leadership Blog / Insights Page  ,WARN,3.0
fe8eb8c2,trust_credibility_signals,Trust & Credibility Signals,6.0,"**Evidence:** The page includes quotes from named Sopra Steria experts (Jan Simons, Eelco Stofbergen, Thijs Bender) which adds credibility. It references reputable external sources (Gartner, McKinsey) and a real client example (large airport operator). However, there are no certifications, awards, or third-party validations visible on the page. There is also no direct mention of compliance standards (e.g., GDPR, NIS2, DORA) or security certifications held by Sopra Steria. <br> **Rationale:** For a cybersecurity decision maker, trust signals like certifications, compliance credentials, and client testimonials are critical. The page provides some credibility but could be stronger and more explicit. <br> **Improvement:** Add visible trust badges, certifications, compliance references, and more detailed client testimonials or case studies with outcomes.",10,Thought Leadership Blog / Insights Page  ,WARN,2.0
fe8eb8c2,calltoaction_effectiveness,Call-to-Action Effectiveness,4.0,"**Evidence:** The blog ends without a clear, persona-relevant call to action. There is no direct invitation to contact Sopra Steria for cybersecurity ecosystem consulting, download a whitepaper, or attend an event. The navigation offers general links but no targeted next steps related to the blog content or persona needs. <br> **Rationale:** Executives need clear, easy next steps to engage further. The lack of a strong CTA reduces conversion potential and engagement. <br> **Improvement:** Include a clear CTA such as “Contact our cybersecurity experts to build trusted digital ecosystems,” “Download our whitepaper on secure supply chain ecosystems,” or “Schedule a consultation to assess your ecosystem risk.”",10,Thought Leadership Blog / Insights Page  ,CONCERN,3.0
7f942435,corporate_positioning_alignment,Corporate Positioning Alignment,0.0,"The page is a 404 error page (""Page not found"") with no visible content or brand messaging.",25,LinkedIn Company Profile Page (Unavailable/Error Page)  ,FAIL,12.5
7f942435,brand_differentiation,Brand Differentiation,0.0,No content present to differentiate Sopra Steria Benelux from competitors or showcase uniqueness.,20,LinkedIn Company Profile Page (Unavailable/Error Page)  ,FAIL,10.0
7f942435,value_proposition_clarity,Value Proposition Clarity,0.0,No value proposition or messaging visible; page is a broken link with error messages only.,20,LinkedIn Company Profile Page (Unavailable/Error Page)  ,FAIL,10.0
7f942435,trust_credibility_signals,Trust & Credibility Signals,0.0,"No trust indicators, certifications, client logos, or testimonials visible due to missing page.",10,LinkedIn Company Profile Page (Unavailable/Error Page)  ,FAIL,5.0
7f942435,calltoaction_effectiveness,Call-to-Action Effectiveness,0.0,No calls to action or navigation options relevant to the persona; only generic error guidance.,10,LinkedIn Company Profile Page (Unavailable/Error Page)  ,FAIL,5.0
97b9dedf,corporate_positioning_alignment,Corporate Positioning Alignment,7.0,"The homepage clearly positions Sopra Steria as a major European tech player with a broad portfolio including consulting, digital services, AI, cybersecurity, and industry expertise. The tagline ""The world is how we shape it"" signals a forward-looking, shaping-the-future mindset. However, the messaging is somewhat generic and broad, lacking explicit emphasis on cybersecurity leadership or regulatory compliance critical to the persona.",25,Corporate Homepage / Brand Introduction  ,WARN,3.75
97b9dedf,brand_differentiation,Brand Differentiation,5.0,The site lists many services and industries but does not strongly differentiate Sopra Steria from other large IT services firms. Cybersecurity is mentioned as a service area but without unique value drivers or examples that would set it apart in a crowded market. The content lacks clear competitive differentiators tailored to the Benelux public sector cybersecurity decision maker.,20,Corporate Homepage / Brand Introduction  ,CONCERN,5.0
97b9dedf,value_proposition_clarity,Value Proposition Clarity,6.0,"The value proposition is implied through broad statements about digital transformation, innovation, and consulting expertise. However, it is not clearly articulated in terms of specific benefits for cybersecurity executives focused on compliance (DORA, NIS2, GDPR), risk management, or resilience. The persona would benefit from clearer, targeted messaging on how Sopra Steria enables secure, compliant, and resilient operations.",20,Corporate Homepage / Brand Introduction  ,WARN,4.0
97b9dedf,trust_credibility_signals,Trust & Credibility Signals,7.0,"The site includes corporate governance, financial reports, ethics and compliance, and data protection notices, which are positive trust signals. The mention of 50,000 employees and presence in nearly 30 countries supports credibility. However, there are no explicit cybersecurity certifications, client case studies, or compliance achievements highlighted that would reassure a risk-averse, compliance-focused executive.",10,Corporate Homepage / Brand Introduction  ,WARN,1.5
97b9dedf,calltoaction_effectiveness,Call-to-Action Effectiveness,5.0,"Calls to action are mostly generic (""Learn more,"" ""Join us,"" ""Contact us"") and oriented toward careers or general exploration. There is no clear, persona-relevant CTA such as ""Explore our cybersecurity solutions,"" ""Request a compliance briefing,"" or ""Schedule a risk assessment consultation,"" which would better guide the persona toward relevant next steps.",10,Corporate Homepage / Brand Introduction  ,CONCERN,2.5
8fe8ea84,corporate_positioning_alignment,Corporate Positioning Alignment,6.0,"The page communicates Sopra Steria Next’s commitment to operational efficiency and digital transformation through automation and process optimisation. It references a sizeable European consulting team and highlights innovation and customer promise delivery. However, the messaging is generic and lacks explicit linkage to the company’s core brand pillars around security, compliance, and resilience, which are critical to the persona.",25,Services Overview / Consulting Practice Page  ,WARN,5.0
8fe8ea84,brand_differentiation,Brand Differentiation,4.0,"The content lists common services (e.g., robotic process automation, hyper automation, Pega low-code solutions) but does not clearly differentiate Sopra Steria from competitors. There are no unique methodologies, proprietary technologies, or success metrics that set them apart. The public sector and cybersecurity focus is only implied via navigation and blog links, not integrated into the core messaging here.",20,Services Overview / Consulting Practice Page  ,CONCERN,6.0
8fe8ea84,value_proposition_clarity,Value Proposition Clarity,5.0,"The value proposition centers on improving operational efficiency and innovation through automation. While this is relevant, it is not clearly tailored to the persona’s priorities such as regulatory compliance, cyber resilience, or risk management. The benefits are stated broadly (“drive efficiency, innovation, and excellence”) without concrete outcomes or KPIs that resonate with a cybersecurity decision maker.",20,Services Overview / Consulting Practice Page  ,CONCERN,5.0
8fe8ea84,trust_credibility_signals,Trust & Credibility Signals,5.0,"The page includes some client references in the “Our success stories” section (e.g., Curium, CZ Zorgverzekeringen), but these are not elaborated or linked to detailed case studies. There is no explicit mention of certifications, compliance standards, or security frameworks that would reassure a risk-averse, compliance-driven executive. The presence of blogs on cybersecurity topics is positive but indirect.",10,Services Overview / Consulting Practice Page  ,CONCERN,2.5
8fe8ea84,calltoaction_effectiveness,Call-to-Action Effectiveness,7.0,"The “LET'S TALK” contact form is prominently placed and collects relevant information, including country and subject, which is good for lead qualification. However, the CTA is generic and does not specifically invite cybersecurity or compliance conversations. There are no tailored CTAs for downloading whitepapers, requesting demos, or accessing security-focused insights, which would better engage this persona.",10,Services Overview / Consulting Practice Page  ,WARN,1.5
4fb3c324,corporate_positioning_alignment,Corporate Positioning Alignment,6.0,"The page references Sopra Steria as ""a major Tech player in Europe with 50,000 employees in nearly 30 countries"" and highlights consulting, digital services, and solutions. The headline ""Welcome to the Future of Innovation"" aligns with a forward-looking corporate message. However, the content is very generic and lacks explicit connection to the company’s cybersecurity expertise or specific brand pillars.",25,Press Release / Corporate Newsroom Page  ,WARN,5.0
4fb3c324,brand_differentiation,Brand Differentiation,4.0,"The content is generic and does not clearly differentiate Sopra Steria from competitors. Phrases like ""Harnessing AI's transformative power"" and ""The world is how we shape it"" are broad and could apply to many tech firms. There is no unique value or competitive edge articulated that would resonate specifically with cybersecurity decision makers in the Benelux public sector.",20,Press Release / Corporate Newsroom Page  ,CONCERN,6.0
4fb3c324,value_proposition_clarity,Value Proposition Clarity,5.0,"The page mentions innovation and AI in broad terms but does not clearly articulate a compelling value proposition tailored to cybersecurity executives concerned with compliance, risk, and resilience. The related content links to cybersecurity and public sector transformation but do not integrate into a clear, persona-relevant offer or solution.",20,Press Release / Corporate Newsroom Page  ,CONCERN,5.0
4fb3c324,trust_credibility_signals,Trust & Credibility Signals,5.0,"The page includes some credibility elements such as company size, geographic reach, and a mention of consulting and digital services. However, there are no explicit trust signals such as certifications, client logos, case studies, regulatory compliance references (e.g., DORA, NIS2, GDPR), or awards that would reassure a security-conscious executive.",10,Press Release / Corporate Newsroom Page  ,CONCERN,2.5
4fb3c324,calltoaction_effectiveness,Call-to-Action Effectiveness,3.0,"There is no clear or prominent call-to-action (CTA) on the page. The only actionable elements are social media links and a PDF download option, neither of which directly guide the persona toward next steps like contacting an expert, requesting a demo, or accessing tailored resources relevant to cybersecurity decision makers.",10,Press Release / Corporate Newsroom Page  ,FAIL,3.5
bda8940b,corporate_positioning_alignment,Corporate Positioning Alignment,5.0,"The page identifies Sopra Steria Nederland B.V. as part of the largest local IT service provider in the Benelux and emphasizes their customer-centric approach and technological innovation. However, the messaging is generic and does not explicitly articulate Sopra Steria’s core cybersecurity brand message or strategic alignment with regulatory compliance and risk management, which are key for the persona.",25,Member Profile / Corporate Overview Page  ,CONCERN,6.25
bda8940b,brand_differentiation,Brand Differentiation,4.0,"The content mentions broad IT services and a showcase project (KING 3.0 for Rotterdam harbor) but lacks clear differentiation from competitors in cybersecurity or compliance expertise. The page does not highlight unique capabilities, certifications, or specialized offerings that would distinguish Sopra Steria in the cybersecurity domain for public sector clients.",20,Member Profile / Corporate Overview Page  ,CONCERN,6.0
bda8940b,value_proposition_clarity,Value Proposition Clarity,5.0,"The value proposition is implied through phrases like “digital advantage,” “innovative solutions,” and “helping customers solve problems,” but it is vague and not tailored to the persona’s priorities such as regulatory compliance (e.g., DORA, NIS2, GDPR), risk management, or cyber resilience. The showcase example is operational but not clearly linked to cybersecurity or compliance benefits.",20,Member Profile / Corporate Overview Page  ,CONCERN,5.0
bda8940b,trust_credibility_signals,Trust & Credibility Signals,6.0,"The page includes a client showcase with a real-world project (KING 3.0) and mentions collaboration with the Rotterdam Harbor Authority, which adds some credibility. However, there are no explicit trust signals such as cybersecurity certifications, compliance accreditations, awards, or executive endorsements that would strongly reassure a CISO or similar decision maker. Privacy and cookie policy details are thorough but generic.",10,Member Profile / Corporate Overview Page  ,WARN,2.0
bda8940b,calltoaction_effectiveness,Call-to-Action Effectiveness,6.0,"Contact details (email and phone) and a link to the company website are provided, which are relevant next steps. However, there is no clear, persona-focused call to action such as downloading compliance whitepapers, requesting a cybersecurity consultation, or accessing relevant case studies. The CTAs are generic and not compelling for an executive seeking strategic cybersecurity partnerships.",10,Member Profile / Corporate Overview Page  ,WARN,2.0
6be18313,corporate_positioning_alignment,Corporate Positioning Alignment,7.0,"The blog page clearly reflects Sopra Steria’s broad positioning as a digital transformation and cybersecurity consultancy with a strong emphasis on innovation and technology. The presence of multiple industry sectors and topics (including Public Sector and Cybersecurity) aligns with the company’s core brand. However, the messaging is somewhat generic and lacks a focused narrative specifically tailored to cybersecurity decision makers in the Benelux public sector. There is no explicit, concise statement of the company’s unique approach or mission on this page itself.",25,Thought Leadership Blog / Insights Hub  ,WARN,3.75
6be18313,brand_differentiation,Brand Differentiation,6.0,"The content covers a wide range of topics including AI, cybersecurity, compliance, and innovation, which are relevant to the persona. However, the blog articles and filters do not strongly differentiate Sopra Steria from competitors. The topics are common industry themes without clear unique insights or proprietary frameworks highlighted. The blog authors are named but without bios or credentials that could help establish thought leadership distinctiveness.",20,Thought Leadership Blog / Insights Hub  ,WARN,4.0
6be18313,value_proposition_clarity,Value Proposition Clarity,6.0,"The value proposition is implied through the breadth of content on cybersecurity, compliance, and innovation, but it is not explicitly stated or emphasized on the blog landing page. For a CISO or security executive, clear articulation of how Sopra Steria enables compliance with DORA, NIS2, GDPR, or how it enhances cyber resilience would be more compelling. The blog format tends to be informational rather than persuasive or solution-oriented.",20,Thought Leadership Blog / Insights Hub  ,WARN,4.0
6be18313,trust_credibility_signals,Trust & Credibility Signals,5.0,"The page includes many recent blog posts with dates and author names, which helps credibility. However, there are no visible client logos, case studies, certifications, awards, or testimonials on this page that would strongly reassure a risk-averse executive. The absence of direct references to regulatory compliance achievements or security certifications weakens trust signals for this persona.",10,Thought Leadership Blog / Insights Hub  ,CONCERN,2.5
6be18313,calltoaction_effectiveness,Call-to-Action Effectiveness,4.0,"The blog page lacks clear, persona-relevant calls to action (CTAs). There are no visible prompts to contact Sopra Steria for cybersecurity consulting, download compliance whitepapers, or register for events/webinars focused on cyber risk management. The navigation is extensive but unfocused, and the next steps for a decision maker looking for solutions or engagement are not obvious.",10,Thought Leadership Blog / Insights Hub  ,CONCERN,3.0
51dceb19,corporate_positioning_alignment,Corporate Positioning Alignment,7.0,"The page clearly communicates Sopra Steria’s evolution, growth, and positioning as a top European digital transformation player with a strong entrepreneurial spirit and collaborative approach. It highlights acquisitions and strategic moves that underpin its market presence. However, the messaging is broad and historical rather than sharply focused on cybersecurity or regulatory compliance, which are critical for this persona.",25,Corporate About Us / Brand History Page  ,WARN,3.75
51dceb19,brand_differentiation,Brand Differentiation,4.0,"The history page mainly lists acquisitions and growth milestones without explicitly differentiating Sopra Steria’s cybersecurity capabilities or unique value compared to competitors. While it mentions the acquisition of EVA Group (cybersecurity firm), it lacks clear statements on how Sopra Steria stands out in cybersecurity innovation, compliance expertise, or risk management.",20,Corporate About Us / Brand History Page  ,CONCERN,6.0
51dceb19,value_proposition_clarity,Value Proposition Clarity,5.0,"The value proposition is implicit—Sopra Steria is a leading European digital services company with broad capabilities. However, for a cybersecurity decision maker focused on compliance and risk, the page does not clearly articulate specific benefits, solutions, or outcomes related to cybersecurity resilience, regulatory compliance (e.g., DORA, NIS2, GDPR), or risk management. The messaging is generic and historical.",20,Corporate About Us / Brand History Page  ,CONCERN,5.0
51dceb19,trust_credibility_signals,Trust & Credibility Signals,6.0,"The page includes credible proof points such as revenue figures (€5.8B in 2024), employee count (51,000), geographic reach (nearly 30 countries), and references to acquisitions that bolster capabilities (including cybersecurity). However, it lacks direct references to certifications, awards, client testimonials, case studies, or compliance credentials that would strongly reassure a compliance-focused executive.",10,Corporate About Us / Brand History Page  ,WARN,2.0
51dceb19,calltoaction_effectiveness,Call-to-Action Effectiveness,3.0,"There is no clear or relevant call-to-action (CTA) on this page tailored to the persona. The page is informational and historical, with no prompts to engage further on cybersecurity services, compliance solutions, or contact points for decision makers. This limits its utility for executives seeking next steps or deeper engagement.",10,Corporate About Us / Brand History Page  ,FAIL,3.5
58559e0e,corporate_positioning_alignment,Corporate Positioning Alignment,8.0,"The page clearly positions Sopra Steria as a major European tech player with a broad consulting and digital services portfolio. The tagline “The world is how we shape it” conveys a proactive, shaping role aligned with innovation and transformation. The presence of multiple industry sectors and service lines including cybersecurity shows alignment with the company’s core brand message. However, the messaging is somewhat broad and could be more explicitly tied to cybersecurity leadership and compliance, which are key for this persona.",25,Corporate Homepage / Corporate Services Overview  ,PASS,2.5
58559e0e,brand_differentiation,Brand Differentiation,6.0,"The site highlights a wide range of services and geographic reach, which is positive. However, differentiation is mostly implicit rather than explicit. There is limited direct comparison or unique positioning against competitors, especially in cybersecurity and compliance domains critical to this persona. The mention of certifications (e.g., Mendix Delivery Excellence) is good but not strongly linked to cybersecurity or regulatory compliance leadership.",20,Corporate Homepage / Corporate Services Overview  ,WARN,4.0
58559e0e,value_proposition_clarity,Value Proposition Clarity,7.0,"The value proposition is communicated through service categories like “Cybersecurity,” “Management & Digital Transformation,” and “Cloud and infrastructure management.” The inclusion of compliance-related content (e.g., DORA, NIS2) in whitepapers and insights is relevant. Yet, the homepage and main navigation do not prominently or succinctly articulate a compelling, persona-specific value proposition focused on regulatory compliance, risk management, and cyber resilience. This reduces immediate clarity for a CISO-level decision maker.",20,Corporate Homepage / Corporate Services Overview  ,WARN,3.0
58559e0e,trust_credibility_signals,Trust & Credibility Signals,7.0,"The site includes credible elements such as client stories, whitepapers, certifications, and news about leadership appointments. The presence of detailed insights on compliance topics (e.g., NIS2, DORA) and cybersecurity offerings supports trust. However, there is a lack of visible third-party endorsements, awards, or client logos on the homepage that could strengthen immediate credibility for a risk-averse executive. The cookie consent notice indicates compliance with privacy but also highlights a technical gap in content loading.",10,Corporate Homepage / Corporate Services Overview  ,WARN,1.5
58559e0e,calltoaction_effectiveness,Call-to-Action Effectiveness,5.0,"The CTAs are mostly generic (“Discover,” “Read More,” “Meet the Expert”) and scattered across different sections. There is no clear, strong CTA tailored to cybersecurity decision makers, such as “Request a Compliance Assessment,” “Schedule a Cybersecurity Consultation,” or “Download Regulatory Compliance Guide.” The navigation is comprehensive but lacks focused next steps that drive engagement from a senior cybersecurity persona.",10,Corporate Homepage / Corporate Services Overview  ,CONCERN,2.5
