page_id,persona_id,first_impression,language_tone_feedback,information_gaps,trust_credibility_assessment,business_impact_analysis,effective_copy_examples,ineffective_copy_examples,overall_sentiment,engagement_level,conversion_likelihood
fe8eb8c2,The_BENELUX_Technology_Innovation_Leader,,,,,,,,Neutral,Low,Low
7f942435,The_BENELUX_Technology_Innovation_Leader,,,,,,,,Neutral,Low,Low
97b9dedf,The_BENELUX_Technology_Innovation_Leader,,,,,,"""Will your company survive the AI revolution? For future success businesses need to stop talking about AI and instead understand and integrate it into their operations."": As a CTO/CDO, harnessing AI to drive business value is a top priority for me. This headline grabs my attention by framing AI as an existential issue and implying Sopra Steria has a perspective on operationalizing AI vs. just talking about it. That aligns well with my goals. | ""7 in 10 European companies judge startup collaboration as ""vital"" to their AI strategy, reveals a Sopra Steria report"": As a technology leader exploring AI innovation, hard data on peer companies' AI strategies, especially regarding startup partnerships, provides valuable context for my decisions. Referencing this Sopra Steria research builds credibility that they understand the AI landscape and my challenges.","""Shaping Technology across Europe"": As a C-suite technology leader focused on driving business value through AI and digital transformation, this tagline feels generic and lacks a clear tie-in to my strategic priorities. It doesn't convey how Sopra Steria can tangibly help me achieve ""Confident Momentum"" in my role. | ""Welcome to our Corporate website"": As an executive decision maker, I'm looking for substantive information relevant to my challenges, not a generic welcome message. This doesn't inspire confidence that the content will be tailored to my needs.",Neutral,Low,Low
8fe8ea84,The_BENELUX_Technology_Innovation_Leader,,,,,,"""With a team of over 50 consultants across Europe, we improve operational efficiency by optimising and automating business processes to ensure your operations run smoothly and effectively."": As a technology leader, this statement provides useful context about their team size and geographic scope. More importantly, it speaks directly to my goal of improving operational efficiency through process optimization and automation. This aligns well with my priorities. | ""What we offer: Performance management, Process optimisation, Target operating model, Robotic process automation, Test automation, Hyper automation, Intelligent test automation, Pega Low-code solutions"": As a technology decision-maker, I appreciate this concise list of their specific service offerings. Capabilities like RPA, test automation, and low-code platforms are highly relevant to my digital transformation goals. Seeing these competencies helps me gauge if they can address my needs.","""We're passionate about transforming your business. Our customised solutions drive efficiency, innovation, and excellence to ensure your business stays ahead of the competition."": As a CTO/CDO, this copy feels generic and lacks the specificity I need. What exact solutions do they offer and how do they tangibly drive efficiency and innovation? I need to see proof points and outcomes, not just vague promises. | ""We're here to help you unlock the full potential of your operations and achieve remarkable results."": Again, as a C-suite technology executive, I find this language too vague and promotional. What defines the ""full potential"" of my operations and what constitutes ""remarkable results""? I need tangible examples and KPIs, not fluff.",Neutral,Low,Low
4fb3c324,The_BENELUX_Technology_Innovation_Leader,,,,,,"""Discover how AI is revolutionizing cybersecurity and giving you a strategic edge."": As a technology leader balancing innovation with security, this directly addresses one of my key priorities. It positions AI as a strategic enabler rather than just a buzzword. I would be interested to learn more about their specific AI-driven cybersecurity solutions. | ""Transforming public services for a citizen-centric future: robust, agile, effective, and connected."": Although my role is not in the public sector, this copy demonstrates an understanding of the key attributes (robust, agile, effective, connected) that matter to technology leaders like myself. It shows they can frame their solutions in terms of tangible business and customer outcomes.","""Welcome to the Future of Innovation"": As a technology & innovation leader, this headline feels generic and lacks a clear value proposition for my role and priorities. It doesn't speak to how the company will tangibly enable innovation. | ""Sopra Steria, a major Tech player in Europe with 50,000 employees in nearly 30 countries, is recognised for its consulting, digital services and solutions."": While the company's scale and capabilities may be impressive, as a C-suite leader I need to understand how those translate into specific business outcomes and competitive advantages for my organization. Size alone is not a compelling differentiator.",Neutral,Low,Low
bda8940b,The_BENELUX_Technology_Innovation_Leader,,,,,,,,Neutral,Low,Low
6be18313,The_BENELUX_Technology_Innovation_Leader,,,,,,"""AI beyond the hype: what the Microsoft AI Tour Brussels taught us about moving beyond proof of concept to full-scale deployment"": As a Technology & Innovation Leader, I appreciate content that cuts through the AI hype and provides practical insights on moving from POCs to production deployments. This headline suggests the article will share learnings and best practices that are directly relevant to my AI transformation goals. | ""The power of semantics: how reliable data transforms AI"": Connecting data reliability to AI outcomes aligns well with my priorities. I'm always looking for ways to harness data and AI to unlock tangible business value. This headline promises insights on how quality data can enhance AI initiatives, which is very relevant for me.","""Will your company survive the AI revolution?"": As a strategic business leader responsible for driving growth and transformation through technology, this headline feels alarmist and vague. It doesn't provide any tangible information about how AI can deliver business value, which is my primary focus. | ""Data poisoning: the phantom menace"": While data quality is an important issue, this Star Wars reference feels out of place for a serious technology discussion. As a C-suite leader, I prefer more straightforward, business-oriented language.",Neutral,Low,Low
51dceb19,The_BENELUX_Technology_Innovation_Leader,,,,,"If I'm being frank, the business impact of this history page is likely minimal for a CTO/CDO like myself. While it provides some useful context on Sopra Steria's background and evolution, it doesn't give me the information I need to make a confident decision or clearly understand the value they provide. To improve this page, I would recommend:

1) Framing the content more around the key priorities and challenges of technology leaders, rather than an internal company view. Speak directly to how you help us succeed.

2) Providing more specifics and proof points around your capabilities, solutions, methodologies, and client results. I need to concretely grasp what differentiates you.

3) Including direct quotes and case studies from CTO/CDO clients you've partnered with. Hearing from peers about the impact you've driven is hugely validating.

4) Highlighting relevant analyst recognition, awards, and IP that demonstrate your expertise and leadership in areas that matter to technology decision makers.

5) Offering a clear next step or call-to-action for someone in my shoes to easily learn more or connect with your team. Make the path forward frictionless.

By incorporating these elements, the page would shift from a company-centric history lesson to a more powerful, persona-specific value proposition. That's what will capture the attention and interest of a technology leader like me.","""Today, the Group ranks among the top 5 European digital transformation players, having earned a reputation for providing end-to-end solutions to address the core business needs of large companies and organisations, helping them remain competitive and grow."": As a CTO/CDO, Sopra Steria's position as a top 5 player and track record with large enterprises catches my attention. The focus on end-to-end solutions to drive competitiveness and growth aligns well with my own objectives. I'd be interested to learn more about the specific solutions and outcomes they've delivered in this space. | ""With the acquisition of Sodifrance in 2020, the Group becomes a leader in digital services for insurance and welfare protection."": Given my role in driving transformation, Sopra Steria's targeted acquisition to establish leadership in the insurance vertical shows a level of industry focus and expertise that resonates with me. As a technology decision maker, I look for partners that deeply understand my business context and can tailor solutions accordingly. This helps build their credibility.","""For us, digital is first and foremost a human adventure."": As a CTO/CDO focused on driving business value through technology, this statement comes across as vague and lacking substance. I need to understand how Sopra Steria's approach translates into tangible outcomes and ROI for my organization. Humanizing digital is nice, but how does it solve my key challenges? | ""The Sopra Steria 2020 Project is launched to improve the Group's performance in all areas and increase its added value."": From my perspective as a technology leader, this provides no insight into how Sopra Steria can help me achieve my strategic priorities. It's an inward-facing statement about their own initiative without any connection to the value it delivers to clients like me. I need to know what specific capabilities and solutions they bring to the table.",Neutral,High,High
58559e0e,The_BENELUX_Technology_Innovation_Leader,,,,,,"""The Future of Generative AI: Insights and Strategies for 2025. Our latest report offers a detailed analysis of the GenAI landscape, combining insights from various sources and Sopra Steria's AI specialists. It highlights key trends, technological advancements, and strategic recommendations for 2025."": As a CTO/CDO, unlocking business value through AI is a top priority for me. This content demonstrates Sopra Steria's forward-looking expertise in this critical area and provides the type of strategic insights and recommendations that are valuable for shaping my technology roadmap. The 2025 focus aligns with my long-term planning horizon. | ""DORA: A New Pillar of Digital Resilience. The importance of a unified, pragmatic approach to compliance"": Balancing innovation with security and compliance is a constant challenge in my role. This content signals that Sopra Steria understands this pain point and can help me navigate complex regulatory landscapes like DORA in a practical way, which builds credibility.","""We empower you to excel by streamlining processes, enhancing productivity, and driving innovation in a dynamic business environment."": As a strategic technology leader, this high-level statement lacks the specificity and proof points I need to understand how Sopra Steria can tangibly support my key priorities around digital transformation and harnessing data/AI. The language is too generic to be impactful. | ""Sopra Steria, a major Tech player in Europe with 50,000 employees in nearly 30 countries, is recognised for its consulting, digital services and solutions."": While the scale and geographic reach of Sopra Steria may be notable, as a C-suite technology leader this broad description does not give me a clear sense of their specific capabilities or track record of delivering business outcomes that are relevant to my priorities and challenges.",Neutral,Low,Low
ce6ef35e,The_BENELUX_Technology_Innovation_Leader,,,,,,"""With our extensive team of data scientists, we use a blend of statistics, mathematics, software engineering, and industry expertise to develop responsible AI-powered solutions that deliver tangible value to your organisation."": As a technology leader, I appreciate that Sopra Steria highlights their multidisciplinary approach and focus on delivering tangible business value with AI. This aligns with my goal of strategically leveraging AI for measurable impact while ensuring responsible deployment. | ""We collaborate with you to identify high-impact use cases and assess ROI throughout the experimentation and production phases."": As a strategic business leader, ROI is a key consideration in any technology investment. I appreciate that Sopra Steria proactively addresses this and positions themselves as a collaborative partner in identifying high-value AI use cases. This gives me confidence that they understand my business priorities.","""AI is fundamentally reshaping the way businesses operate and creating new opportunities across industries and markets."": As a CTO/CDO, this statement is too broad and generic. It lacks specificity on how AI can directly impact my business and drive measurable outcomes. I need more tangible examples relevant to my industry and role. | ""Organisations that hesitate to embrace these advances risk falling behind the curve, jeopardising their relevance in an increasingly digital world."": While the urgency to adopt AI is clear to me as a CTO/CDO, this copy feels alarmist without providing a clear path forward. I would prefer to see more emphasis on the specific benefits and opportunities of embracing AI rather than just the risks of inaction.",Neutral,Low,Low
b53c7bea,The_BENELUX_Technology_Innovation_Leader,,,,,,"""Sopra Steria harnesses AI and autonomous transport to improve efficiency and customer experience as you build the future of transport."": As a technology leader, this copy resonates by highlighting concrete capabilities (AI, autonomous transport) that align with my priorities to improve operational efficiency and customer experience through innovation. It positions Sopra Steria as a forward-thinking partner. | ""With Sopra Steria, you'll benefit from unparalleled professional excellence, people-centric solutions and inspiring innovations that are redefining the future of industry, manufacturing, logistics, retail and telecom."": This copy is effective in conveying Sopra Steria's differentiated expertise and innovative mindset across industries relevant to me. The emphasis on ""people-centric solutions"" and ""redefining the future"" aligns well with my mission to leverage technology for business transformation.","""Let's talk"": As a CTO/CDO, this generic call-to-action does not compel me to engage further. It lacks specificity on what value a conversation would provide to help me drive transformation and growth through technology. | ""Our comprehensive digital solutions help to streamline processes, drive innovation and increase business value."": While this touches on some of my high-level objectives, it is too vague. As a CTO/CDO, I need to understand the specific solutions and proven outcomes to assess business value and alignment with my digital transformation roadmap.",Neutral,Low,Low
4b79a42a,The_BENELUX_Technology_Innovation_Leader,,,,,,,,Neutral,Low,Low
d83b69a8,The_BENELUX_Technology_Innovation_Leader,,,,,,"""By combining these four categories, we offer our customers a 360-degree view that aligns AI investments with business priorities, identifies use cases that are mature for deployment and those still in the exploration phase, and accelerates the deployment of AI on a large scale,"" explains Fabrice Asvazadourian.: As a CTO/CDO, I appreciate how this methodology aims to provide a holistic view to align AI investments with my business priorities. The focus on identifying mature vs. exploratory use cases and accelerating large-scale deployment directly addresses my key goals and pain points.","""Beyond focusing on the development of AI algorithms to address priority use cases, the real challenge is to successfully industrialise them. Today, only 1 in 7 algorithms reaches the production phase,"" adds Fabrice Asvazadourian.: As a C-suite technology leader, this statistic about the low success rate of AI algorithms reaching production is concerning. However, it lacks context around why this happens and what specific challenges need to be overcome. I need more actionable insights.",Neutral,Low,Low
ad80a76c,The_BENELUX_Technology_Innovation_Leader,,,,,,"""The Future of Generative AI: Insights and Strategies for 2025. Our latest report offers a detailed analysis of the GenAI landscape, combining insights from various sources and Sopra Steria's AI specialists. It highlights key trends, technological advancements, and strategic recommendations for 2025."": As a CTO/CDO, I'm keenly interested in emerging technologies like generative AI and how they can be strategically leveraged to transform the business. This copy effectively grabs my attention by focusing on a highly relevant topic and providing a forward-looking perspective with actionable insights and recommendations tailored to my priorities.","""We empower you to excel by streamlining processes, enhancing productivity, and driving innovation in a dynamic business environment."": As a strategic C-suite technology leader, this high-level statement lacks specificity on how exactly Sopra Steria will help me achieve my key priorities of digital transformation and harnessing data/AI for business value. The language is vague and doesn't clearly articulate outcomes relevant to my role and challenges.",Neutral,Low,Low
f52cdbdc,The_BENELUX_Technology_Innovation_Leader,,,,,,"""Sopra Steria, a major Tech player in Europe with 50,000 employees in nearly 30 countries, is recognised for its consulting, digital services and solutions."": As a CTO/CDO, Sopra Steria's scale, geographic reach, and breadth of offerings are compelling. This positions them as a potential strategic partner to help me navigate complex digital initiatives. However, I still need more details on their specific AI and data capabilities to fully assess fit.","""The world is how we shape it"": As a strategic technology leader, this tagline feels vague and lacks a clear connection to how Sopra Steria can tangibly help me drive digital transformation and business value. I need more specifics on their unique capabilities and track record.",Neutral,Low,Low
cded0b85,The_BENELUX_Technology_Innovation_Leader,,,,,,"""We identify risks and provide actionable recommendations to optimize your Azure domains, platforms, and workloads for peak performance."": As a CTO/CDO, I appreciate the focus on risk identification and actionable recommendations. Optimizing our Azure environment for performance is a key priority and pain point for me. This shows an understanding of my needs. | ""Expertly managed services to run complex applications using automation, AIOps, DevSecOps, and Site Reliability Engineering (SRE). Our moder cloud practices ensure seamless, efficient operations on Azure."": As someone responsible for balancing innovation with security and efficiency, I'm encouraged by the mention of modern practices like AIOps, DevSecOps and SRE to manage complex apps on Azure. This aligns well with my priorities.","""Sopra Steria migration, modernisation and Cloud-native apps development A value-led, flexible, and cost-effective path to accelerate your cloud adoption."": As a strategic Technology & Innovation Leader, this high-level statement lacks the specificity and tangible business outcomes I need to justify investment. It's too generic to be compelling. | ""Enhance business functions like sales, customer service, and finance with Microsoft Dynamics 365 Copilot."": As a C-suite technology leader, I need more than just a list of business functions. What are the measurable efficiency gains and ROI I can expect? How will this integrate with my existing systems? The value prop is too vague.",Neutral,Low,Low
624753c4,The_BENELUX_Technology_Innovation_Leader,,,,,,"""Sopra Steria supports banks along the entire value chain, from strategy to operations, enabling them to succeed in the new digital normal."": As a CTO/CDO, I appreciate that Sopra Steria understands the full scope of digital transformation in banking. Supporting the entire value chain is critical for me to drive end-to-end change. This shows they grasp my strategic mandate. | ""Discover actionable strategies to better manage risk, protect your customers, and combat financial crime effectively. Act now to stay ahead of evolving threats."": Financial crime and risk management are top priorities for me. Calling out ""actionable strategies"" to address these challenges catches my attention. I would engage further to learn what those entail, as staying ahead of threats is paramount.","""The financial services sector is evolving swiftly as regulatory requirements continually adapt to meet societal needs."": As a C-suite technology leader, this statement is too vague and generic. It doesn't speak to my specific challenges around balancing innovation with security and compliance. I need more targeted insights. | ""Together with our clients, we enhance the customer experience, optimise performance, deliver competitive differentiation, and identify new revenue streams."": While the outcomes mentioned align with my goals at a high level, there are no specifics on how they achieve this. As a technology leader, I need to understand their unique approach and see proof points to build trust.",Neutral,Low,Low
2aa6d30b,The_BENELUX_Technology_Innovation_Leader,,,,,,"""We also help our clients to address sustainable development challenges as an integral part of their digital transformation projects."": As a C-suite technology leader, it's important to me that our partners can help us address sustainability as part of our broader digital transformation efforts. This statement shows Sopra Steria understands the strategic link between these two priorities, which aligns well with my perspective. | ""Sopra Steria innovates to support environmental causes as part of an ambitious programme launched over 10 years ago. The Group is a leader in environmental conservation and action against climate change with internationally recognised commitments and results."": As a technology executive, I'm looking for partners with a proven track record of delivering on their sustainability commitments. The mention of Sopra Steria's long-running program and recognition as an environmental leader helps build credibility that they can support my organization's sustainability goals as part of our technology strategy.","""We take care to recruit employees from a broad diversity of backgrounds and ensure that we treat everyone fairly."": As a CTO/CDO focused on driving strategic transformation, this statement about employee diversity and fairness, while positive, does not directly address my key priorities around leveraging technology and AI to create business value. It lacks a clear connection to my role and goals. | ""Sopra Steria strives for a more inclusive and ethical digital society, in keeping with its mission: leverage digital technology to build a positive future for all."": While I appreciate the aspirational vision, as a CTO/CDO I need more specifics on how Sopra Steria will tangibly help my organization leverage technology to drive business outcomes. The language here is quite broad and doesn't speak directly to my role and priorities.",Neutral,Low,Low
